{
  "$schema": "../../schemas/decision-record.schema.json",
  "schemaVersion": 2,
  "id": "D21",
  "title": "不新增慢速輪詢；手動重試作為有期限的機制補丁",
  "capabilities": ["game-recording/rally-recording"],
  "decision": "不新增慢速輪詢。文案分岔講實話：navigator.onLine 為 false 時說「恢復連線後自動送出」（真的會），為 true 時說「會持續嘗試送出」並顯示手動重試按鈕。按鈕的顯示條件與文案共用同一個判斷，不引入第二個條件。這顆按鈕被明確記錄為機制缺口的補丁而非 UX 功能：它存在的唯一理由是退避表會終止而沒有人偵測恢復，由使用者的手指補上。`offline-recording` 的驗收條件已登記持久重播上線後移除它。離線時不顯示：使用者自己關的網路他知道，一顆必定失敗的按鈕等於暗示按了或許有用。",
  "context": "本 Change 要在待送狀態下說出一句保證。「離線中／恢復連線後自動送出」在飛航模式下為真：online 事件觸發 flush，送出所有 pending。但在「連上網路卻到不了伺服器」的情境下，我們從頭到尾都是 online，online 事件永遠不會觸發；背景重試在退避表用盡後（約二十二秒）不再排程，於是沒有任何機制會偵測到伺服器恢復。也就是說，D1 特地納進來的那個情境，恰好是唯一不能講「會自動送出」的情境。Google Docs、Notion 等 local-first 產品都不提供手動重試按鈕，因為它們的背景重試永不終止，使用者不需要一顆按鈕；我們有一個它們沒有的終局狀態。retryable-entry-writes 的 D2 在否決「只靠 piggyback、不做背景退避」時已經寫下這個失效模式的預言：「一個宣稱同步仍在進行中的指示器會是不真實的」，並以退避表把它的時間上界壓到二十二秒——沒被預見的是連續記球會不斷把那個上界重設，所以它在真實節奏下從未生效。",
  "alternatives": [
    {
      "option": "加一道慢速輪詢，讓退避用盡後仍每三十至六十秒試一次",
      "reason": "兩種情境的承諾都成真、文案可統一，但它動到重試機制本身（本 Change 的非目標），並帶進一個新的生命週期問題：輪詢什麼時候停——比賽結束？離開頁面？永遠？那是 offline-recording 的 outbox 要回答的，在這裡回答等於把本 Change 變成半張 `offline-recording`。"
    },
    {
      "option": "兩種情境都顯示重試按鈕",
      "reason": "離線時按下必定失敗。使用者無從分辨自己按了為什麼沒用，而唯一有效的行動（開網路）沒有被指出來。這是「有一個動作」勝過「有正確的動作」的錯誤取捨。"
    },
    {
      "option": "兩種情境都不顯示，與 Google Docs、Notion 對齊",
      "reason": "它們沒有這顆按鈕是因為沒有終局狀態，不是因為按鈕不好。照抄結論而不照抄前提，會讓連上網路卻到不了伺服器的使用者完全沒有出路。"
    },
    {
      "option": "統一用不做保證的文案，避開這個問題",
      "reason": "退回到「N 筆未同步」那種只說事實不說結果的講法，就放棄了本 Change 的核心價值——告訴使用者他的紀錄是安全的。`retryable-queue-persistence` 已經讓那件事為真，UI 不說出口才是缺口。"
    }
  ],
  "consequences": [
    "存在一段時間，系統把一個本該由機制承擔的責任交給使用者的手指。這是有意識、有期限的妥協，期限記在 `offline-recording` 的驗收條件上。",
    "按下按鈕後狀態不會改變（attempts 不重設，mayBeAttemptedAgain 也不變），因此需要一個只屬於該按鈕的 pending 呈現。以元件內的 useState 實作，不改變全域狀態。",
    "「恢復連線後自動送出」這句話只在 navigator.onLine 為 false 時出現，而該值為 false 是它唯一可靠的方向。這使得這句保證在它出現的每一種情況下都成立。",
    "本 Change 因此在兩個地方依賴 navigator.onLine——選文案與選按鈕——但兩者都不影響狀態判定，最壞情況是措辭挑錯而指示器仍然靜態、仍然說已保存。這個降級是安全的。"
  ],
  "revisitTriggers": [
    "`offline-recording` 的持久重播上線：終局狀態消失，按鈕失去存在理由，應一併移除而不是留著成為第二條路徑。",
    "現場證據顯示使用者在「連線有問題」狀態下不會發現或不會按那顆按鈕：那代表把責任交給手指這個妥協無效，慢速輪詢應該提前。",
    "退避表被調整為不終止（例如改為無上限的指數退避加抖動）：那等於在本 Change 之外把洞補起來，按鈕同樣應該移除。",
    "本決策的前提被推翻：它成立於「其他 local-first 產品不提供手動重試，因為其背景重試永不終止」，而該前提是二手來源的歸納而非實地稽核（見 Design 頁的 References）。若其中之一其實有這顆按鈕、或其重試其實會終止，論證的基礎就變了。"
  ],
  "originChange": "honest-sync-status"
}
