{
  "schemaVersion": 2,
  "id": "0029",
  "title": "型別重建屬邊界，領域規則屬 entity——validateRallyEntry 全部是前者",
  "capabilities": [
    "game-recording/rally-recording",
    "game-recording/persistence",
    "platform/clean-architecture"
  ],
  "decision": "以兩問決定落點，有順序：**(1) 這是在重建 wire format 丟失的型別嗎？** 是的話屬邊界，由 schema parse 一次。**(2) 這是一條關於排球、關於什麼構成合法 Game 的規則，換傳輸協定與換資料庫都仍然成立嗎？** 是的話屬 entity。依此清點，`validateRallyEntry` 檢查的四件事——`type` 在 `MoveType` 內、`num` 是 0 至 14 的整數、`win` 是 boolean、`score` 是數字——**沒有一條是排球規則**。它們全部在回答「這個值真的是它宣稱的型別嗎」，之所以需要在執行期問，只因為 TypeScript 的型別被抹除而 JSON 沒有型別。那是 parse，屬邊界。因此刪除 `validateRallyEntry` 連同 `MOVE_TYPES` 與 `LAST_SCORING_MOVE`、它在 use case 的呼叫，以及 `validateLineupPlayers` 開頭的 shape 前置檢查（同樣是型別重建，其註解自承是替沒有 schema 的 route 擦屁股）。`validateLineupPlayers` 的 roster 成員比對**留在 entities**：「被指名的球員必須在這支隊伍的名單上」換掉 HTTP、換掉 MongoDB 都仍然成立，是第二問的典型例子——它需要的名單由 use case 傳入，entity 自己不查詢。`num` 的上界改由 `scoringMoves.length - 1` 提供，手抄的 `LAST_SCORING_MOVE` 與釘住它的測試一併刪除。本決策使已晉升至 `game-recording/rally-recording` 與 `game-recording/persistence` 的兩份 D26 superseded。",
  "context": "`rally-entry-validation` 的 D2 在 `src/entities/game.ts` 建立了 `validateRallyEntry`，由 `record-rallies.usecase.ts` 逐筆呼叫。那個決策在當時是對的——route 沒有任何 schema——而它明確記下一條 revisit trigger：「route 層的 request schema 上線之後，重新確認兩層驗證的分工：邊界回答『形狀對不對』，entity 回答『意義對不對』，兩者不應互相複製。」本 Change 是那個觸發點。判斷「該放哪一層」時有一個誘人但錯誤的判準：**這個檢查需不需要資料庫狀態**。它與 Clean Architecture 的判準只是相關，不是同一件事——領域不變式**經常**需要 aggregate 的狀態，但那是相關性不是定義。兩個方向都會誤判：`away.num` 必須在 `scoringMoves[home.num].outcome` 內是一條排球規則，卻只需要查表；「這個 gameId 存在嗎」需要資料庫，卻只是一個 404 而非業務規則。CA 真正問的是規則的**射程**——換一個傳輸協定、換一個資料庫，這條規則還成立嗎？",
  "alternatives": [
    {
      "option": "以「需不需要資料庫狀態」作為分層判準",
      "reason": "本 Change 一度採用它，查核後撤回。它不是 CA 的判準，只是與之相關的一個表徵，且兩個方向都會誤判：把只需查表的排球規則（`away.num` 必須在 `outcome` 內）推去邊界，把只是存在性檢查的 404 拉進 entity。它在 `validateRallyEntry` 這個案例上恰好給出正確答案，因為那四條本來就不是領域規則——但正確結論配錯誤理由，會在下一個案例上失效。"
    },
    {
      "option": "兩層並存：schema 在邊界擋 HTTP，`validateRallyEntry` 留著保護 use case",
      "reason": "留著的東西不是領域規則，是同一份 parse 的第二次執行。兩份「什麼是合法 rally」的定義必然漂移，而漂移的代價由讀者承擔。若擔心的是非 HTTP 的呼叫端，那個缺口的正解是讓所有 delivery mechanism 都經過同一個邊界，不是在內層複製 parse。"
    },
    {
      "option": "把跨欄位自洽檢查（`num` 決定 `type` / `win`、`away.num` 在 `outcome` 內）一併移到 schema 的 `.refine()`",
      "reason": "誘人，因為它同樣只需查表。但依第二問它是排球規則——「主隊扣球得分時，客隊那一側只可能是這幾種動作」換掉傳輸與儲存都成立——所以它屬 entity。而 entity 要查 `scoringMoves` 就會撞上循環相依（該檔 import `MoveType`），因此它仍然以那張表下沉為前置。本 Change 不動它。"
    },
    {
      "option": "等 `scoringMoves` 下沉之後再一併處理",
      "reason": "把一個現在就能做的收斂，綁在一個尚未開始、且需要先拆分 zh-TW 顯示字串的重構後面。刪除 `validateRallyEntry` 不需要那張表移動——需要它的是跨欄位檢查，而那本來就不在本 Change 範圍內。"
    }
  ],
  "consequences": [
    "「什麼構成一顆合法的 rally」在型別層面只有一份定義，位於邊界。",
    "`validateRallyEntry` 刪除後，rally 的領域規則在 entities 裡數量是零。這是誠實的呈現——它本來就沒有任何一條，跨欄位自洽是唯一的候選而它尚未實作。",
    "`validateLineupPlayers` 只剩 roster 比對，函式名稱因此名副其實。",
    "手抄的 `LAST_SCORING_MOVE = 14` 消失，上界直接從表取得。這一項原本列在 `scoringMoves` 下沉工作的驗收條件裡，本 Change 提前完成。",
    "兩份已晉升的 D26 記錄與 `platform/clean-architecture` 頁面的一條 Known gap 需要在 Archive 時標記 superseded 或改寫。",
    "跨欄位自洽檢查的落點是 entities，**仍然以 `scoringMoves` 下沉為前置**。本 Change 不改變那個順序。",
    "`test/integration/rally-validation.itest.ts` 的三個案例在刪除後原封不動仍會通過——zod 對缺欄位、超出 enum、缺 `win` 產生同樣的 400 與 `CommonReason.INVALID_INPUT`。它斷言的是可觀察行為，因此剛好是一份現成的等價性證明。"
  ],
  "revisitTriggers": [
    "出現繞過 route 的第二個 delivery mechanism：邊界不再只有一個，需要讓它們共用同一份 parse，而不是在內層補一份。",
    "`scoringMoves` 下沉至 entities：跨欄位自洽檢查取得落點，屆時 entities 第一次持有 rally 的領域規則。",
    "出現第一條真正的 rally 領域規則（例如「後排球員不得記錄前排攻擊」）：它屬 entity，本記錄關於「entities 裡目前零條」的陳述隨之失效。",
    "entities 取得 branded 或 nominal 型別，使 `Rally` 只能透過 parse 產生：型別重建的保證延伸到型別本身，第一問的答案改變。"
  ],
  "originChange": "request-schema-boundary"
}
