{
  "schemaVersion": 2,
  "id": "0111",
  "title": "Teal is the interface brand colour; coral is the mark colour, sourced from --court",
  "capabilities": ["platform/design-system"],
  "context": "`--court` aliased `--destructive`, so brand coral had to serve as an error fill, where white text on it reaches only 2.38:1.",
  "decision": "Teal `primary` is the interface brand colour. Coral #FC7A56 is the mark colour: the V mark, the recording court and the landing court. `--court` is its source token for the court surfaces, and the V mark keeps the same value as the literal `V_CORAL`, because the splash and icon renderers have no stylesheet. Error and danger colours no longer reuse brand coral.",
  "alternatives": [
    {
      "option": "Keep coral as both destructive and court",
      "reason": "Fails AA for white text on every destructive fill."
    },
    {
      "option": "Darken the court too",
      "reason": "Loses the brand coral the mark and landing are built on."
    }
  ],
  "consequences": [
    "Landing and recording court stay brand coral because they read --court.",
    "The V_CORAL literal must stay equal to --court."
  ],
  "originChange": "design-authority"
}
